{
  "profile": "ZTCO01/ZTCM01",
  "synthetic": true,
  "reader_statement": {
    "profile": "ZTKA01",
    "synthetic": true,
    "comparison": "declared_issued_ms",
    "origin": "https://owner.invalid",
    "account_hex": "01010101010101010101010101010101",
    "root_pin_hex": "5a54525002010101010101010101010101010101010000000000000001046b17d1f2e12c4247f8bce6e563a440f277037d812deb33a0f4a13945d898c2964fe342e2fe1a7f9b8ee7eb4a7c0f9e162bce33576b315ececbb6406837bf51f5",
    "expected_root_fingerprint_hex": "650363c155189c0015b94a30cd545f34c4894e88f12d486f4e47694634068540",
    "accepted_previous_version": "6",
    "accepted_previous_digest_hex": "0909090909090909090909090909090909090909090909090909090909090909",
    "accepted_manifest_hex": "5a544d4102010101010101010101010101010101010000000000000001000000000000000700000000000003e8000000000036f6500909090909090909090909090909090909090909090909090909090909090909046b17d1f2e12c4247f8bce6e563a440f277037d812deb33a0f4a13945d898c2964fe342e2fe1a7f9b8ee7eb4a7c0f9e162bce33576b315ececbb6406837bf51f504018b1bd41b441815d172b5fcaa6b88178f1856c553c28c1dee2aac20e4b75c51dd047cf27b188d034f7e8a52380304b51ac3c08969e277f21b35a60b48fc4766997807775510db8ed040293d9ac69f7430dbba7dade63ce982299e04b79d227873d10404040404040404040404040404040405050505050505050505050505050505000400000000000003e8000000000036f6500102a7f5fac9ffbf8b4528c8cc22c33b6aaa953bcc41110ccbf6ca96b57e6a6241d1045ecbe4d1a6330a44c8f7ef951d4bf165e6c6b721efada985fb41661bc6e7fd6c8734640c4998ff7e374b06ce1a64a2ecd82ab036384fb83d9a79b127a27d50320000000000000000000000000000000000000000000000000000000000000000000c00000000000003e8000000000036f65001049820627b90765b6838372f3ca368aedd591abc11b36b0116111eb210189866d404e2534a3532d08fbba02dde659ee62bd0031fe2db785596ef509302446b030852e0f1575a4c633cc719dfee5fda862d764efc96c3f30ee0055c42c23f184ed8c60404040404040404040404040404040405050505050505050505050505050505000200000000000003e8000000000036f6500106b0d8345f27248e9485b6ab3aeb3d458b6786ee54fa3650613829964e79446587046b17d1f2e12c4247f8bce6e563a440f277037d812deb33a0f4a13945d898c2964fe342e2fe1a7f9b8ee7eb4a7c0f9e162bce33576b315ececbb6406837bf51f50000000000000000000000000000000000000000000000000000000000000000000000000000000003e8000000000036f65001ada5c025961f79b24a510a707956c90938e05e5100b5b859a0d64032a56332907a5c040b7f5b3b9b1b0293af8c9cc4813cf19b912f1a689e57b9552675899ce9",
    "statement_hex": "5a544b4101030707070707070707070707070707070701010101010101010101010101010101001568747470733a2f2f6f776e65722e696e76616c6964000000000000000100000000000000070000000000000001650363c155189c0015b94a30cd545f34c4894e88f12d486f4e476946340685408ddb1fefed2291fc2c1655f08622deaa59ca89eee9ce4d6030eccb4c877afc7ba7f5fac9ffbf8b4528c8cc22c33b6aaa953bcc41110ccbf6ca96b57e6a6241d1045ecbe4d1a6330a44c8f7ef951d4bf165e6c6b721efada985fb41661bc6e7fd6c8734640c4998ff7e374b06ce1a64a2ecd82ab036384fb83d9a79b127a27d503200000000000007d00000000000000bb8c5b01b738c57cc6b292f7ec89e90af5061393433df35fbb24be2802251438b054c9d4533ed0b08b4748ae4847da73b414d1284bf6bc96614c6cbba23c1db8913",
    "unsigned_hex": "5a544b4101030707070707070707070707070707070701010101010101010101010101010101001568747470733a2f2f6f776e65722e696e76616c6964000000000000000100000000000000070000000000000001650363c155189c0015b94a30cd545f34c4894e88f12d486f4e476946340685408ddb1fefed2291fc2c1655f08622deaa59ca89eee9ce4d6030eccb4c877afc7ba7f5fac9ffbf8b4528c8cc22c33b6aaa953bcc41110ccbf6ca96b57e6a6241d1045ecbe4d1a6330a44c8f7ef951d4bf165e6c6b721efada985fb41661bc6e7fd6c8734640c4998ff7e374b06ce1a64a2ecd82ab036384fb83d9a79b127a27d503200000000000007d00000000000000bb8",
    "statement_digest_hex": "3b1a11d1a86a359ebf212abf06337e5a529a412e1d29293438841ce9adc63781",
    "declared_issued_ms": "2000",
    "declared_until_ms": "3000",
    "result_kind": "historical_integrity"
  },
  "successor_manifest_hex": "5a544d4102010101010101010101010101010101010000000000000001000000000000000800000000000007d1000000000036f6508ddb1fefed2291fc2c1655f08622deaa59ca89eee9ce4d6030eccb4c877afc7b046b17d1f2e12c4247f8bce6e563a440f277037d812deb33a0f4a13945d898c2964fe342e2fe1a7f9b8ee7eb4a7c0f9e162bce33576b315ececbb6406837bf51f505018b1bd41b441815d172b5fcaa6b88178f1856c553c28c1dee2aac20e4b75c51dd047cf27b188d034f7e8a52380304b51ac3c08969e277f21b35a60b48fc4766997807775510db8ed040293d9ac69f7430dbba7dade63ce982299e04b79d227873d10404040404040404040404040404040405050505050505050505050505050505000400000000000003e8000000000036f6500102a4a9d80338f8f3128dcffa19dc03c4f41421168052512861b6b0074046eea40304b58d65eaac131ae2b9759e9fc0c115c9a1f7d3238e80ad05ed75e054788e425dfdbe69d3b32a074fe121a9e9727adbe16e636a650582bb0a88e2d5b3c29d1a640000000000000000000000000000000000000000000000000000000000000000000c00000000000003e8000000000036f6500102a7f5fac9ffbf8b4528c8cc22c33b6aaa953bcc41110ccbf6ca96b57e6a6241d1045ecbe4d1a6330a44c8f7ef951d4bf165e6c6b721efada985fb41661bc6e7fd6c8734640c4998ff7e374b06ce1a64a2ecd82ab036384fb83d9a79b127a27d50320000000000000000000000000000000000000000000000000000000000000000000c00000000000003e8000000000036f65002049820627b90765b6838372f3ca368aedd591abc11b36b0116111eb210189866d404e2534a3532d08fbba02dde659ee62bd0031fe2db785596ef509302446b030852e0f1575a4c633cc719dfee5fda862d764efc96c3f30ee0055c42c23f184ed8c60404040404040404040404040404040405050505050505050505050505050505000200000000000003e8000000000036f6500106b0d8345f27248e9485b6ab3aeb3d458b6786ee54fa3650613829964e79446587046b17d1f2e12c4247f8bce6e563a440f277037d812deb33a0f4a13945d898c2964fe342e2fe1a7f9b8ee7eb4a7c0f9e162bce33576b315ececbb6406837bf51f50000000000000000000000000000000000000000000000000000000000000000000000000000000003e8000000000036f65001ed7c1e02881b055f553b83603ccd5db7f9b8170dda1863f3f04e1764adc5c8e414d2fb9aff4702e93f8cc23c383a340a02e9104c83efb547884ccc3c9efd15e4",
  "successor_statement_hex": "5a544b4101030808080808080808080808080808080801010101010101010101010101010101001568747470733a2f2f6f776e65722e696e76616c6964000000000000000100000000000000080000000000000002650363c155189c0015b94a30cd545f34c4894e88f12d486f4e47694634068540aab0c543c5f7179aeb59e7b24dad893c3906109756f324157bf24624098bb550a4a9d80338f8f3128dcffa19dc03c4f41421168052512861b6b0074046eea40304b58d65eaac131ae2b9759e9fc0c115c9a1f7d3238e80ad05ed75e054788e425dfdbe69d3b32a074fe121a9e9727adbe16e636a650582bb0a88e2d5b3c29d1a6400000000000007d20000000000000bb80cad51c3d1a07eec55147d65e94252bdb59394fc2343cda5e8a1faf52d7e7857596a337d156bc0daabf39a01c4705d8cf544c66f7cb4e2d24a215721b13389af",
  "contact_hex": "0b0b0b0b0b0b0b0b0b0b0b0b0b0b0b0b",
  "routing_digest_hex": "bfb65de6e0f430140757d752965feeb68271d9705b29802200b78e91a420db8d",
  "name_hex": "5a54434f0101010101010101010101010101010101010b0b0b0b0b0b0b0b0b0b0b0b0b0b0b0b0000000000000001000000000000000100000000000000070000000000000001a7f5fac9ffbf8b4528c8cc22c33b6aaa953bcc41110ccbf6ca96b57e6a6241d18ddb1fefed2291fc2c1655f08622deaa59ca89eee9ce4d6030eccb4c877afc7b3b1a11d1a86a359ebf212abf06337e5a529a412e1d29293438841ce9adc63781bfb65de6e0f430140757d752965feeb68271d9705b29802200b78e91a420db8d0c0c0c0c0c0c0c0c0c0c0c0c0c0c0c0cb0d8345f27248e9485b6ab3aeb3d458b6786ee54fa3650613829964e79446587041678085d2be9263aa4d410a5bcd242cdd0a4b9a2845e9795b67464318311b4ab61aeee552418e418bd491d14770d5072a9ad7c5651a04f37c9614fecb8343ad2000000177a6e1c278cf03abb5049fabddd27957bb8382edc032bfb344de14d3a1020db3c12c46e3bd5a3385814f41cf32f46d64655f6989a38ba661290251fe484d5837d8ea3560d57d4786c042b428f8b64fc9c72e8f23c9c7694",
  "notes_hex": "5a54434f0102010101010101010101010101010101010b0b0b0b0b0b0b0b0b0b0b0b0b0b0b0b0000000000000001000000000000000100000000000000070000000000000001a7f5fac9ffbf8b4528c8cc22c33b6aaa953bcc41110ccbf6ca96b57e6a6241d18ddb1fefed2291fc2c1655f08622deaa59ca89eee9ce4d6030eccb4c877afc7b3b1a11d1a86a359ebf212abf06337e5a529a412e1d29293438841ce9adc63781bfb65de6e0f430140757d752965feeb68271d9705b29802200b78e91a420db8d0c0c0c0c0c0c0c0c0c0c0c0c0c0c0c0cb0d8345f27248e9485b6ab3aeb3d458b6786ee54fa3650613829964e7944658704b04eb1f5a67a844339662dbb65818522ce1096ea5b56a1fbe5529df8f00c7de6757cb98e9ec14e884ea010e53acce9992a4fdc10138a3e0db1f96f4410f735bc000000153d917db192ba64fea7d4067a84f4ad79c8f27332d3931b3c6584b4b2e1e00d7fba72b09e56ab251e54c5d4b2b763a83304847730787533314c139026fb201f3713135938db2abb773d0981714b53698c8ed4777a24",
  "replacement_notes_hex": "5a54434f0102010101010101010101010101010101010b0b0b0b0b0b0b0b0b0b0b0b0b0b0b0b0000000000000002000000000000000100000000000000080000000000000002a4a9d80338f8f3128dcffa19dc03c4f41421168052512861b6b0074046eea403aab0c543c5f7179aeb59e7b24dad893c3906109756f324157bf24624098bb550c1d0eb147750dec278bac9889debe5df45f70164e69a9e47c8f7863b83ae06c4bfb65de6e0f430140757d752965feeb68271d9705b29802200b78e91a420db8d0d0d0d0d0d0d0d0d0d0d0d0d0d0d0d0db0d8345f27248e9485b6ab3aeb3d458b6786ee54fa3650613829964e794465870446116cbf8dbcce8060c0050c177a79b2fe1b8993228e9107be7e5a98424a61802a464fccada3dface563d10ede2c45103bd997ed2587cc86d6bfcee123ed2cb500000015fe07a95d3c72bd1c9fb3a3b2ae2221e20867971285eedcd1eb5923ea5149ae936b14f20f1581a8c96cef6a90bf58f5022080706fac4127aef3acc1939073c0f5c39a581bb4ac7ec5e5e1d48c68e1786aa206ac9008",
  "create_hex": "5a54434d0101010101010101010101010101010101010b0b0b0b0b0b0b0b0b0b0b0b0b0b0b0b000000000000000000000000000000010c0c0c0c0c0c0c0c0c0c0c0c0c0c0c0c0000000000000000000000000000000000000000000000000000000000000000000000000000000100000000000000078ddb1fefed2291fc2c1655f08622deaa59ca89eee9ce4d6030eccb4c877afc7b3b1a11d1a86a359ebf212abf06337e5a529a412e1d29293438841ce9adc63781bfb65de6e0f430140757d752965feeb68271d9705b29802200b78e91a420db8d0000000000000000010000000000000001fb5dbfd5932c4324ab510d990696a89a0a97c89a896bceb4e7b596d60a90b921010000000000000001846a8c8c09b9a6c0477fd36b96a15e1ffca2222211f3a1a865f6eca470ecc6b9e12adda72a0bcee90a36a9f7d9d43acbfee153b1ea2350ab35976fa5c786f478476f435275d562895b2ea28fb0b3a33c2bf9b997904bb8248fa944f70e16d31e",